iri,term_localName,label,definition,comments,examples,organized_in,issued,status,replaces,rdf_type,term_iri,abcd_equivalence,flags
http://rs.tdwg.org/dwc/terms/version/pathway-2021-03-29,pathway,Pathway,The process by which an Organism came to be in a given place at a given time.,"Recommended best practice is to use controlled value strings from the controlled vocabulary designated for use with this term, listed at http://rs.tdwg.org/dwc/doc/pw/. For details, refer to https://doi.org/10.3897/biss.3.38084","`releasedForUse`, `otherEscape`, `transportContaminant`, `transportStowaway`, `corridor`, `unaided`",http://rs.tdwg.org/dwc/terms/Occurrence,3/29/2021,superseded,http://rs.tdwg.org/dwc/terms/version/pathway-2020-10-13,http://www.w3.org/1999/02/22-rdf-syntax-ns#Property,http://rs.tdwg.org/dwc/terms/pathway,,simple
http://rs.tdwg.org/dwc/terms/version/phylum-2023-06-28,phylum,Phylum,The full scientific name of the phylum or division in which the dwc:Taxon is classified.,,`Chordata` (phylum); `Bryophyta` (division),http://rs.tdwg.org/dwc/terms/Taxon,6/28/2023,recommended,http://rs.tdwg.org/dwc/terms/version/phylum-2017-10-06,http://www.w3.org/1999/02/22-rdf-syntax-ns#Property,http://rs.tdwg.org/dwc/terms/phylum,DataSets/DataSet/Units/Unit/Identifications/Identification/TaxonIdentified/HigherTaxa/HigherTaxon/HigherTaxonName with HigherTaxa/HigherTaxon/HigherTaxonRank = phylum,simple
http://rs.tdwg.org/dwc/terms/version/pointRadiusSpatialFit-2023-06-28,pointRadiusSpatialFit,Point Radius Spatial Fit,"The ratio of the area of the point-radius (dwc:decimalLatitude, dwc:decimalLongitude, dwc:coordinateUncertaintyInMeters) to the area of the true (original, or most specific) spatial representation of the dcterms:Location. Legal values are 0, greater than or equal to 1, or undefined. A value of 1 is an exact match or 100% overlap. A value of 0 should be used if the given point-radius does not completely contain the original representation. The dwc:pointRadiusSpatialFit is undefined (and should be left empty) if the original representation is any geometry without area (e.g., a point or polyline) and without uncertainty and the given georeference is not that same geometry (without uncertainty). If both the original and the given georeference are the same point, the dwc:pointRadiusSpatialFit is 1.","Detailed explanations with graphical examples can be found in the Georeferencing Best Practices, Chapman and Wieczorek, 2020 (https://doi.org/10.15468/doc-gg7h-s853).",`0`; `1`; `1.5708`,http://purl.org/dc/terms/Location,6/28/2023,recommended,http://rs.tdwg.org/dwc/terms/version/pointRadiusSpatialFit-2020-08-20,http://www.w3.org/1999/02/22-rdf-syntax-ns#Property,http://rs.tdwg.org/dwc/terms/pointRadiusSpatialFit,DataSets/DataSet/Units/Unit/Gathering/SiteCoordinateSets/SiteCoordinates/PointRadiusSpatialFit,simple
http://rs.tdwg.org/dwc/terms/version/preparations-2023-09-13,preparations,Preparations,A list (concatenated and separated) of preparations and preservation methods for a dwc:MaterialEntity.,"Recommended best practice is to separate the values in a list with space vertical bar space (` | `). This term has an equivalent in the dwciri: namespace that allows only an IRI as a value, whereas this term allows for any string literal value.",`fossil`; `cast`; `photograph`; `DNA extract`; `skin | skull | skeleton`; `whole animal (ETOH) | tissue (EDTA)`,http://rs.tdwg.org/dwc/terms/MaterialEntity,9/13/2023,recommended,http://rs.tdwg.org/dwc/terms/version/preparations-2023-06-28,http://www.w3.org/1999/02/22-rdf-syntax-ns#Property,http://rs.tdwg.org/dwc/terms/preparations,DataSets/DataSet/Units/Unit/SpecimenUnit/Preparations/PreparationsText,simple
http://digir.net/schema/conceptual/darwin/2003/1.0/version/PreparationType-2003-06-13,PreparationType,Preparation Type,"The type of preparation (skin. slide, etc). Probably best to add this as a record element rather than access point. Should be a list of preparations for a single collection record.",,,,6/13/2003,deprecated,,http://www.w3.org/1999/02/22-rdf-syntax-ns#Property,http://digir.net/schema/conceptual/darwin/2003/1.0/PreparationType,,
http://rs.tdwg.org/dwc/terms/version/PreservedSpecimen-2023-09-18,PreservedSpecimen,Preserved Specimen,A specimen that has been preserved.,,`a plant on an herbarium sheet`; `a cataloged lot of fish in a jar`,,9/18/2023,recommended,http://rs.tdwg.org/dwc/terms/version/PreservedSpecimen-2018-09-06,http://www.w3.org/2000/01/rdf-schema#Class,http://rs.tdwg.org/dwc/terms/PreservedSpecimen,RecordBasisEnum/PreservedSpecimen,simple
http://digir.net/schema/conceptual/darwin/2003/1.0/version/PreviousCatalogNumber-2003-06-13,PreviousCatalogNumber,Previous Catalog Number,"The previous (fully qualified) catalog number of the Cataloged Item if the item earlier identified by another Catalog Number, either in the current catalog or another Institution / catalog. A fully qualified Catalog Number is preceded by Institution Code and Collection Code, with a space separating the each subelement. Referencing a previous Catalog Number does not imply that a record for the referenced item is or is not present in the corresponding catalog, or even that the referenced catalog still exists. This access point is intended to provide a way to retrieve this record by previously used identifier, which may used in the literature. In future versions of this schema this attribute should be set-valued.",,,,6/13/2003,deprecated,,http://www.w3.org/1999/02/22-rdf-syntax-ns#Property,http://digir.net/schema/conceptual/darwin/2003/1.0/PreviousCatalogNumber,,
http://rs.tdwg.org/dwc/terms/version/previousIdentifications-2023-06-28,previousIdentifications,Previous Identifications,A list (concatenated and separated) of previous assignments of names to the dwc:Organism.,Recommended best practice is to separate the values in a list with space vertical bar space (` | `).,"`Chalepidae`; `Pinus abies`; `Anthus sp., field ID by G. Iglesias | Anthus correndera, expert ID by C. Cicero 2009-02-12 based on morphology`",http://rs.tdwg.org/dwc/terms/Organism,6/28/2023,recommended,http://rs.tdwg.org/dwc/terms/version/previousIdentifications-2017-10-06,http://www.w3.org/1999/02/22-rdf-syntax-ns#Property,http://rs.tdwg.org/dwc/terms/previousIdentifications,DataSets/DataSet/Units/Unit/Identifications/Identification with PreferredFlag = false,simple
http://rs.tdwg.org/dwc/terms/version/recordedBy-2017-10-06,recordedBy,Recorded By,"A list (concatenated and separated) of names of people, groups, or organizations responsible for recording the original Occurrence. The primary collector or observer, especially one who applies a personal identifier (recordNumber), should be listed first.",Recommended best practice is to separate the values in a list with space vertical bar space (` | `).,`José E. Crespo`. `Oliver P. Pearson | Anita K. Pearson` (where the value in recordNumber `OPP 7101` corresponds to the collector number for the specimen in the field catalog of Oliver P. Pearson).,http://rs.tdwg.org/dwc/terms/Occurrence,10/6/2017,superseded,http://rs.tdwg.org/dwc/terms/version/recordedBy-2014-10-23,http://www.w3.org/1999/02/22-rdf-syntax-ns#Property,http://rs.tdwg.org/dwc/terms/recordedBy,DataSets/DataSet/Units/Unit/Gathering/GatheringAgents/GatheringAgentsText,simple
http://rs.tdwg.org/dwc/terms/version/recordedByID-2021-07-15,recordedByID,Recorded By ID,"A list (concatenated and separated) of the globally unique identifier for the person, people, groups, or organizations responsible for recording the original Occurrence.","Recommended best practice is to provide a single identifier that disambiguates the details of the identifying agent. If a list is used, it is recommended to separate the values in the list with space vertical bar space ( | ). The order of the identifiers on any list for this term can not be guaranteed to convey any semantics.",`https://orcid.org/0000-0002-1825-0097` (for an individual); `https://orcid.org/0000-0002-1825-0097 | https://orcid.org/0000-0002-1825-0098` (for a list of people).,http://rs.tdwg.org/dwc/terms/Occurrence,7/15/2021,superseded,,http://www.w3.org/1999/02/22-rdf-syntax-ns#Property,http://rs.tdwg.org/dwc/terms/recordedByID,not in ABCD,simple
http://rs.tdwg.org/dwc/terms/version/recordNumber-2017-10-06,recordNumber,Record Number,"An identifier given to the Occurrence at the time it was recorded. Often serves as a link between field notes and an Occurrence record, such as a specimen collector's number.",,`OPP 7101`,http://rs.tdwg.org/dwc/terms/Occurrence,10/6/2017,superseded,http://rs.tdwg.org/dwc/terms/version/recordNumber-2009-04-24,http://www.w3.org/1999/02/22-rdf-syntax-ns#Property,http://rs.tdwg.org/dwc/terms/recordNumber,DataSets/DataSet/Units/Unit/CollectorsFieldNumber,simple
http://rs.tdwg.org/dwc/terms/version/RelatedBasisOfRecord-2008-11-19,RelatedBasisOfRecord,Related Basis of Record,The nature of the related resource. Recommended best practice is to use the same controlled vocabulary as for basisOfRecord.,"Example: ""PreservedSpecimen""",,http://rs.tdwg.org/dwc/terms/ResourceRelationship,11/19/2008,deprecated,,http://www.w3.org/1999/02/22-rdf-syntax-ns#Property,http://rs.tdwg.org/dwc/terms/RelatedBasisOfRecord,not in ABCD,
http://rs.tdwg.org/dwc/curatorial/version/RelatedCatalogedItems-2007-04-17,RelatedCatalogedItems,Related Cataloged Items,"One or more GlobalUniqueIdentifiers (cf. http://wiki.tdwg.org/twiki/bin/view/DarwinCore/GlobalUniqueIdentifier ) of related objects or observations, optionally preceded by the nature of the relationship. Examples: ""(sibling of) URN:catalog:MVZ:Mammal:1234"", ""(endoparasite of) URN:catalog:FMNH:Bird:41321"", ""(sheet 2 of 2) URN:WTU:VascularPlants:353087"".",,,,4/17/2007,deprecated,http://digir.net/schema/conceptual/darwin/2003/1.0/version/RelatedCatalogedItems-2003-06-17,http://www.w3.org/1999/02/22-rdf-syntax-ns#Property,http://rs.tdwg.org/dwc/curatorial/RelatedCatalogedItems,DataSets/DataSet/Units/Unit/Associations/UnitAssociation/AssociatedUnitSourceInstitutionCode + DataSets/DataSet/Units/Unit/Associations/UnitAssociation/AssociatedUnitSourceName + DataSets/DataSet/Units/Unit/Associations/UnitAssociation/AssociatedUnitID,
http://digir.net/schema/conceptual/darwin/2003/1.0/version/RelatedCatalogItem-2003-06-13,RelatedCatalogItem,Related Cataloged Item,"The fully qualified identifier of a related Catalog Item (a reference to another specimen); Institution Code, Collection Code, and Catalog Number of the related Cataloged Item, where a space separates the three subelements.",,,,6/13/2003,deprecated,,http://www.w3.org/1999/02/22-rdf-syntax-ns#Property,http://digir.net/schema/conceptual/darwin/2003/1.0/RelatedCatalogItem,,
http://rs.tdwg.org/dwc/dwcore/version/RelatedInformation-2007-04-17,RelatedInformation,Related Information,"Free text references to information not delivered via the conceptual schema, including URLs to specimen details, publications, bibliographic references, etc.",,,,4/17/2007,deprecated,http://www.iobis.org/obis/version/RecordURL-2005-07-10,http://www.w3.org/1999/02/22-rdf-syntax-ns#Property,http://rs.tdwg.org/dwc/dwcore/RelatedInformation,DataSets/DataSet/Units/Unit/RecordURI,
http://rs.tdwg.org/dwc/terms/version/relatedResourceID-2018-09-06,relatedResourceID,Related Resource ID,"An identifier for a related resource (the object, rather than the subject of the relationship).",,`dc609808-b09b-11e8-96f8-529269fb1459`,http://rs.tdwg.org/dwc/terms/ResourceRelationship,9/6/2018,recommended,http://rs.tdwg.org/dwc/terms/version/relatedResourceID-2017-10-06,http://www.w3.org/1999/02/22-rdf-syntax-ns#Property,http://rs.tdwg.org/dwc/terms/relatedResourceID,DataSets/DataSet/Units/Unit/Associations/UnitAssociation/AssociatedUnitSourceInstitutionCode + DataSets/DataSet/Units/Unit/Associations/UnitAssociation/AssociatedUnitSourceName + DataSets/DataSet/Units/Unit/Associations/UnitAssociation/AssociatedUnitID,extension
http://rs.tdwg.org/dwc/terms/version/relatedResourceType-2009-04-24,relatedResourceType,Related Resource Type,The type of the related resource. Recommended best practice is to use a controlled vocabulary.,"Examples: ""StillImage"", ""MovingImage"", ""Sound"", PhysicalObject"", ""PreservedSpecimen"", FossilSpecimen"", LivingSpecimen"", ""HumanObservation"", ""MachineObservation"", ""Location"", ""Taxonomy"", ""NomeclaturalChecklist"", ""Publication""",,http://rs.tdwg.org/dwc/terms/ResourceRelationship,4/24/2009,deprecated,,http://www.w3.org/1999/02/22-rdf-syntax-ns#Property,http://rs.tdwg.org/dwc/terms/relatedResourceType,not in ABCD,
http://rs.tdwg.org/dwc/terms/version/relationshipAccordingTo-2018-09-06,relationshipAccordingTo,Relationship According To,"The source (person, organization, publication, reference) establishing the relationship between the two resources.",,`Julie Woodruff`,http://rs.tdwg.org/dwc/terms/ResourceRelationship,9/6/2018,recommended,http://rs.tdwg.org/dwc/terms/version/relationshipAccordingTo-2017-10-06,http://www.w3.org/1999/02/22-rdf-syntax-ns#Property,http://rs.tdwg.org/dwc/terms/relationshipAccordingTo,not in ABCD,extension
http://rs.tdwg.org/dwc/terms/version/relationshipEstablishedDate-2023-06-28,relationshipEstablishedDate,Relationship Established Date,The date-time on which the relationship between the two resources was established.,Recommended best practice is to use a date that conforms to ISO 8601-1:2019.,`1963-03-08T14:07-0600` (8 Mar 1963 at 2:07pm in the time zone six hours earlier than UTC); `2009-02-20T08:40Z` (20 February 2009 8:40am UTC); `2018-08-29T15:19` (3:19pm local time on 29 August 2018); `1809-02-12` (some time during 12 February 1809); `1906-06` (some time in June 1906); `1971` (some time in the year 1971); `2007-03-01T13:00:00Z/2008-05-11T15:30:00Z` (some time during the interval between 1 March 2007 1pm UTC and 11 May 2008 3:30pm UTC); `1900/1909` (some time during the interval between the beginning of the year 1900 and the end of the year 1909); `2007-11-13/15` (some time in the interval between 13 November 2007 and 15 November 2007),http://rs.tdwg.org/dwc/terms/ResourceRelationship,6/28/2023,recommended,http://rs.tdwg.org/dwc/terms/version/relationshipEstablishedDate-2020-08-12,http://www.w3.org/1999/02/22-rdf-syntax-ns#Property,http://rs.tdwg.org/dwc/terms/relationshipEstablishedDate,not in ABCD,extension
http://rs.tdwg.org/dwc/terms/version/relationshipOfResource-2023-06-28,relationshipOfResource,Relationship Of Resource,The relationship of the subject (identified by dwc:resourceID) to the object (identified by dwc:relatedResourceID).,Recommended best practice is to use a controlled vocabulary.,`same as`; `duplicate of`; `mother of`; `offspring of`; `sibling of`; `parasite of`; `host of`; `valid synonym of`; `located within`; `pollinator of members of taxon`; `pollinated specific plant`; `pollinated by members of taxon`; `on slab with`,http://rs.tdwg.org/dwc/terms/ResourceRelationship,6/28/2023,recommended,http://rs.tdwg.org/dwc/terms/version/relationshipOfResource-2021-07-15,http://www.w3.org/1999/02/22-rdf-syntax-ns#Property,http://rs.tdwg.org/dwc/terms/relationshipOfResource,DataSets/DataSet/Units/Unit/Associations/UnitAssociation/AssociationType,extension
http://rs.tdwg.org/dwc/terms/version/relationshipOfResourceID-2023-06-28,relationshipOfResourceID,Relationship Of Resource ID,An identifier for the relationship type (predicate) that connects the subject identified by dwc:resourceID to its object identified by dwc:relatedResourceID.,"Recommended best practice is to use the identifiers of the terms in a controlled vocabulary, such as the OBO Relation Ontology.",`http://purl.obolibrary.org/obo/RO_0002456` (for the relation `pollinated by`); `http://purl.obolibrary.org/obo/RO_0002455` (for the relation `pollinates`); `https://www.inaturalist.org/observation_fields/879` (for the relation `eaten by`),http://rs.tdwg.org/dwc/terms/ResourceRelationship,6/28/2023,recommended,http://rs.tdwg.org/dwc/terms/version/relationshipOfResourceID-2021-07-15,http://www.w3.org/1999/02/22-rdf-syntax-ns#Property,http://rs.tdwg.org/dwc/terms/relationshipOfResourceID,not in ABCD,extension
http://rs.tdwg.org/dwc/terms/version/relationshipRemarks-2023-06-28,relationshipRemarks,Relationship Remarks,Comments or notes about the relationship between the two resources.,,`mother and offspring collected from the same nest`; `pollinator captured in the act`,http://rs.tdwg.org/dwc/terms/ResourceRelationship,6/28/2023,recommended,http://rs.tdwg.org/dwc/terms/version/relationshipRemarks-2018-09-06,http://www.w3.org/1999/02/22-rdf-syntax-ns#Property,http://rs.tdwg.org/dwc/terms/relationshipRemarks,DataSets/DataSet/Units/Unit/Associations/UnitAssociation/Comments,extension
http://digir.net/schema/conceptual/darwin/2003/1.0/version/RelationshipType-2003-06-13,RelationshipType,Relationship Type,"A named or coded valued that identifies the kind relationship between this Collection Item and the referenced Collection Item. Named values include: ""parasite of"", ""epiphyte on"", ""progeny of"", etc. In future versions of this schema this attribute should be set-valued.",,,,6/13/2003,deprecated,,http://www.w3.org/1999/02/22-rdf-syntax-ns#Property,http://digir.net/schema/conceptual/darwin/2003/1.0/RelationshipType,,
http://rs.tdwg.org/dwc/dwcore/version/Remarks-2007-04-17,Remarks,Remarks,Free text comments accompanying the object or observation record.,,,,4/17/2007,deprecated,http://digir.net/schema/conceptual/darwin/2003/1.0/version/Remarks-2003-06-17,http://www.w3.org/1999/02/22-rdf-syntax-ns#Property,http://rs.tdwg.org/dwc/dwcore/Remarks,DataSets/DataSet/Units/Unit/Notes,
http://rs.tdwg.org/dwc/terms/version/reproductiveCondition-2017-10-06,reproductiveCondition,Reproductive Condition,The reproductive condition of the biological individual(s) represented in the Occurrence.,Recommended best practice is to use a controlled vocabulary.,"`non-reproductive`, `pregnant`, `in bloom`, `fruit-bearing`",http://rs.tdwg.org/dwc/terms/Occurrence,10/6/2017,superseded,http://rs.tdwg.org/dwc/terms/version/reproductiveCondition-2009-04-24,http://www.w3.org/1999/02/22-rdf-syntax-ns#Property,http://rs.tdwg.org/dwc/terms/reproductiveCondition,not in ABCD,simple
http://rs.tdwg.org/dwc/terms/version/resourceID-2018-09-06,resourceID,Resource ID,An identifier for the resource that is the subject of the relationship.,,`f809b9e0-b09b-11e8-96f8-529269fb1459`,http://rs.tdwg.org/dwc/terms/ResourceRelationship,9/6/2018,recommended,http://rs.tdwg.org/dwc/terms/version/resourceID-2017-10-06,http://www.w3.org/1999/02/22-rdf-syntax-ns#Property,http://rs.tdwg.org/dwc/terms/resourceID,not in ABCD,extension
http://rs.tdwg.org/dwc/terms/version/ResourceRelationship-2023-09-13,ResourceRelationship,Resource Relationship,A relationship of one rdfs:Resource (http://www.w3.org/2000/01/rdf-schema#Resource) to another.,"Resources can be thought of as identifiable records or instances of classes and may include, but need not be limited to instances of dwc:Occurrence, dwc:Organism, dwc:MaterialEntity, dwc:Event, dcterms:Location, dwc:GeologicalContext, dwc:Identification, or dwc:Taxon.",`an instance of a dwc:Organism is the mother of another instance of a dwc:Organism`; `a uniquely identified dwc:Occurrence represents the same dwc:Occurrence as another uniquely identified dwc:Occurrence`; `a dwc:MaterialEntity is a subsample of another dwc:MaterialEntity`,,9/13/2023,recommended,http://rs.tdwg.org/dwc/terms/version/ResourceRelationship-2023-06-28,http://www.w3.org/2000/01/rdf-schema#Class,http://rs.tdwg.org/dwc/terms/ResourceRelationship,DataSets/DataSet/Units/Unit/Associations,extension
http://rs.tdwg.org/dwc/terms/version/resourceRelationshipID-2023-06-28,resourceRelationshipID,Resource Relationship ID,"An identifier for an instance of relationship between one resource (the subject) and another (dwc:relatedResource, the object).",,`04b16710-b09c-11e8-96f8-529269fb1459`,http://rs.tdwg.org/dwc/terms/ResourceRelationship,6/28/2023,recommended,http://rs.tdwg.org/dwc/terms/version/resourceRelationshipID-2018-09-06,http://www.w3.org/1999/02/22-rdf-syntax-ns#Property,http://rs.tdwg.org/dwc/terms/resourceRelationshipID,not in ABCD,extension
http://dublincore.org/usage/terms/history/#rightsT-001,rights,Rights,Information about rights held in and over the resource.,"Typically, rights information includes a statement about various property rights associated with the resource, including intellectual property rights.",,http://purl.org/dc/terms/,1/14/2008,deprecated,,http://www.w3.org/1999/02/22-rdf-syntax-ns#Property,http://purl.org/dc/terms/rights,not in ABCD,
http://rs.tdwg.org/dwc/terms/version/Sample-2008-11-19,Sample,Sample,"Container class for information about the results of a sampling event (specimen, observation, etc.)",,,,11/19/2008,deprecated,,http://www.w3.org/2000/01/rdf-schema#Class,http://rs.tdwg.org/dwc/terms/Sample,DataSets/DataSet/Units/Unit,
http://rs.tdwg.org/dwc/terms/version/SampleAttribute-2008-11-19,SampleAttribute,Sample Attribute,Container class for information about attributes related to a given sample.,,,,11/19/2008,deprecated,,http://www.w3.org/2000/01/rdf-schema#Class,http://rs.tdwg.org/dwc/terms/SampleAttribute,Datasets/Dataset/Units/Unit/MeasurementsOrFacts,
http://rs.tdwg.org/dwc/terms/version/SampleAttributeAccuracy-2009-01-18,SampleAttributeAccuracy,Sample Attribute Accuracy,The description of the error associated with the SampleAttributeValue.,"Example: ""0.01"", ""normal distribution with variation of 2 m""",,http://rs.tdwg.org/dwc/terms/SampleAttribute,1/18/2009,deprecated,,http://www.w3.org/1999/02/22-rdf-syntax-ns#Property,http://rs.tdwg.org/dwc/terms/SampleAttributeAccuracy,DataSets/DataSet/Units/Unit/MeasurementsOrFacts/MeasurementOrFact/MeasurementOrFactAtomised/Accuracy,
http://rs.tdwg.org/dwc/terms/version/SampleAttributeDeterminedBy-2009-01-23,SampleAttributeDeterminedBy,Sample Attribute Determined By,The agent responsible for having determined the value of the measurement or characteristic of the sample.,"Example: ""Javier de la Torre""",,http://rs.tdwg.org/dwc/terms/SampleAttribute,1/23/2009,deprecated,,http://www.w3.org/1999/02/22-rdf-syntax-ns#Property,http://rs.tdwg.org/dwc/terms/SampleAttributeDeterminedBy,DataSets/DataSet/Units/Unit/MeasurementsOrFacts/MeasurementOrFact/MeasurementOrFactAtomised/MeasuredBy,
http://rs.tdwg.org/dwc/terms/version/SampleAttributeDeterminedDate-2009-01-23,SampleAttributeDeterminedDate,Sample Attribute Determined Date,The date on which the the measurement or characteristic of the sample was made.,"Date may be used to express temporal information at any level of granularity. Recommended best practice is to use an encoding scheme, such as the W3CDTF profile of ISO 8601 [W3CDTF].",,http://rs.tdwg.org/dwc/terms/SampleAttribute,1/23/2009,deprecated,,http://www.w3.org/1999/02/22-rdf-syntax-ns#Property,http://rs.tdwg.org/dwc/terms/SampleAttributeDeterminedDate,DataSets/DataSet/Units/Unit/MeasurementsOrFacts/MeasurementOrFact/MeasurementOrFactAtomised/MeasurementDateTime,
http://rs.tdwg.org/dwc/terms/version/SampleAttributeRemarks-2008-11-19,SampleAttributeRemarks,Sample Attribute Remarks,Comments or notes accompanying the measurement or characteristic of the sample.,"Example: ""tip of tail missing""",,http://rs.tdwg.org/dwc/terms/SampleAttribute,11/19/2008,deprecated,,http://www.w3.org/1999/02/22-rdf-syntax-ns#Property,http://rs.tdwg.org/dwc/terms/SampleAttributeRemarks,not in ABCD,
http://rs.tdwg.org/dwc/terms/version/SampleAttributeUnit-2008-11-19,SampleAttributeUnit,Sample Attribute Unit,The units for the value of the measurement or characteristic of the sample. Recommended best practice is to use International System of Units (SI) units.,"Example: ""mm""",,http://rs.tdwg.org/dwc/terms/SampleAttribute,11/19/2008,deprecated,,http://www.w3.org/1999/02/22-rdf-syntax-ns#Property,http://rs.tdwg.org/dwc/terms/SampleAttributeUnit,DataSets/DataSet/Units/Unit/Gathering/SiteMeasurementsOrFacts/MeasurementOrFact/MeasurementOrFactAtomised/UnitOfMeasurement,
http://rs.tdwg.org/dwc/terms/version/SampleAttributeValue-2008-11-19,SampleAttributeValue,Sample Attribute Value,The value of the measurement or characteristic of the sample.,"Example: ""45""",,http://rs.tdwg.org/dwc/terms/SampleAttribute,11/19/2008,deprecated,,http://www.w3.org/1999/02/22-rdf-syntax-ns#Property,http://rs.tdwg.org/dwc/terms/SampleAttributeValue,DataSets/DataSet/Units/Unit/MeasurementsOrFacts/MeasurementOrFact/MeasurementOrFactAtomised/LowerValue or DataSets/DataSet/Units/Unit/MeasurementsOrFacts/MeasurementOrFact/MeasurementOrFactAtomised/UpperValue,
http://rs.tdwg.org/dwc/terms/version/SampleRemarks-2009-01-18,SampleRemarks,Sample Remarks,Comments or notes about the sample or record.,"Example: ""found dead on road""",,http://rs.tdwg.org/dwc/terms/Sample,1/18/2009,deprecated,http://rs.tdwg.org/dwc/dwcore/version/Remarks-2007-04-17,http://www.w3.org/1999/02/22-rdf-syntax-ns#Property,http://rs.tdwg.org/dwc/terms/SampleRemarks,DataSets/DataSet/Units/Unit/Notes,
http://rs.tdwg.org/dwc/terms/version/sampleSizeUnit-2023-06-28,sampleSizeUnit,Sample Size Unit,"The unit of measurement of the size (time duration, length, area, or volume) of a sample in a sampling dwc:Event.","A dwc:sampleSizeUnit must have a corresponding dwc:sampleSizeValue, e.g., `5` for dwc:sampleSizeValue with `m` for dwc:sampleSizeUnit. This term has an equivalent in the dwciri: namespace that allows only an IRI as a value, whereas this term allows for any string literal value.",`minute`; `hour`; `day`; `metre`; `square metre`; `cubic metre`,http://rs.tdwg.org/dwc/terms/Event,6/28/2023,recommended,http://rs.tdwg.org/dwc/terms/version/sampleSizeUnit-2017-10-06,http://www.w3.org/1999/02/22-rdf-syntax-ns#Property,http://rs.tdwg.org/dwc/terms/sampleSizeUnit,not in ABCD,simple
