iri,term_localName,label,definition,comments,examples,organized_in,issued,status,replaces,rdf_type,term_iri,abcd_equivalence,flags
http://rs.tdwg.org/dwc/iri/version/inCollection-2015-03-27,inCollection,In Collection,Use to link any subject resource that is part of a collection to the collection containing the resource.,"Recommended best practice is to use an IRI from a controlled registry. A ""convenience property"" that replaces literal-value terms related to collections and institutions. See Section 2.7.3 of the Darwin Core RDF Guide for details.",,http://rs.tdwg.org/dwc/terms/attributes/UseWithIRI,3/27/2015,recommended,,http://www.w3.org/1999/02/22-rdf-syntax-ns#Property,http://rs.tdwg.org/dwc/iri/inCollection,not in ABCD,
http://rs.tdwg.org/dwc/iri/version/inDataset-2015-03-27,inDataset,In Dataset,Use to link a subject dataset record to the dataset which contains it.,A string literal name of the dataset can be provided using the term dwc:datasetName. See the Darwin Core RDF Guide for details.,,http://rs.tdwg.org/dwc/terms/attributes/UseWithIRI,3/27/2015,recommended,,http://www.w3.org/1999/02/22-rdf-syntax-ns#Property,http://rs.tdwg.org/dwc/iri/inDataset,not in ABCD,
http://rs.tdwg.org/dwc/iri/version/inDescribedPlace-2015-03-27,inDescribedPlace,In Described Place,Use to link a dcterms:Location instance subject to the lowest level standardized hierarchically-described resource.,"Recommended best practice is to use an IRI from a controlled registry. A ""convenience property"" that replaces Darwin Core literal-value terms related to locations. See Section 2.7.5 of the Darwin Core RDF Guide for details.",`http://vocab.getty.edu/tgn/1019987`,http://rs.tdwg.org/dwc/terms/attributes/UseWithIRI,3/27/2015,recommended,,http://www.w3.org/1999/02/22-rdf-syntax-ns#Property,http://rs.tdwg.org/dwc/iri/inDescribedPlace,not in ABCD,
http://rs.tdwg.org/dwc/terms/version/individualCount-2021-07-15,individualCount,Individual Count,The number of individuals present at the time of the Occurrence.,,"`0`, `1`, `25`",http://rs.tdwg.org/dwc/terms/Occurrence,7/15/2021,superseded,http://rs.tdwg.org/dwc/terms/version/individualCount-2017-10-06,http://www.w3.org/1999/02/22-rdf-syntax-ns#Property,http://rs.tdwg.org/dwc/terms/individualCount,DataSets/DataSet/Units/Unit/Gathering/SiteMeasurementsOrFacts/SiteMeasurementOrFact/MeasurementOrFactAtomised/LowerValue,simple
http://rs.tdwg.org/dwc/terms/version/individualID-2009-04-24,individualID,Individual ID,An identifier for an individual or named group of individual organisms represented in the Occurrence. Meant to accommodate resampling of the same individual or group for monitoring purposes. May be a global unique identifier or an identifier specific to a data set.,"Examples: ""U.amer. 44"", ""Smedley"", ""Orca J 23""",,http://rs.tdwg.org/dwc/terms/Occurrence,4/24/2009,deprecated,,http://www.w3.org/1999/02/22-rdf-syntax-ns#Property,http://rs.tdwg.org/dwc/terms/individualID,DataSets/DataSet/Units/Unit/Identifications/Identification/Result/TaxonIdentified/ScientificName/NameAtomised/Zoological/NamedIndividual or DataSets/DataSet/Units/Unit/ObservationUnit/ObservationUnitIdentifiers/ObservationUnitIdentifier or DataSets/DataSet/Units/Unit/SpecimenUnit/Accessions/AccessionNumber,
http://rs.tdwg.org/dwc/terms/version/informationWithheld-2017-10-06,informationWithheld,Information Withheld,"Additional information that exists, but that has not been shared in the given record.",,"`location information not given for endangered species`, `collector identities withheld | ask about tissue samples`",,10/6/2017,superseded,http://rs.tdwg.org/dwc/terms/version/informationWithheld-2009-04-24,http://www.w3.org/1999/02/22-rdf-syntax-ns#Property,http://rs.tdwg.org/dwc/terms/informationWithheld,DataSets/DataSet/Units/Unit/InformationWithheld,simple
http://rs.tdwg.org/dwc/terms/version/infragenericEpithet-2023-06-28,infragenericEpithet,Infrageneric Epithet,The infrageneric part of a binomial name at ranks above species but below genus.,"The term dwc:infragenericEpithet should be used in conjunction with dwc:genericName, dwc:specificEpithet, dwc:infraspecificEpithet, dwc:taxonRank and dwc:scientificNameAuthorship to represent the individual elements of the complete dwc:scientificName. It can be used to indicate the subgenus placement of a species, which in zoology is often given in parentheses. Can also be used to share infrageneric names such as botanical sections (e.g., `Vicia sect. Cracca`).",`Abacetillus` (for scientificName `Abacetus (Abacetillus) ambiguus`); `Cracca` (for scientificName `Vicia sect. Cracca`),http://rs.tdwg.org/dwc/terms/Taxon,6/28/2023,recommended,http://rs.tdwg.org/dwc/terms/version/infragenericEpithet-2021-07-15,http://www.w3.org/1999/02/22-rdf-syntax-ns#Property,http://rs.tdwg.org/dwc/terms/infragenericEpithet,DataSets/DataSet/Units/Unit/Identifications/Identification/Result/TaxonIdentified/ScientificName/NameAtomised/Bacterial/Subgenus (for bacterial names) or  DataSets/DataSet/Units/Unit/Identifications/Identification/Result/TaxonIdentified/ScientificName/NameAtomised/Zoological/Subgenus (for zoological names) or DataSets/DataSet/Units/Unit/Identifications/Identification/Result/TaxonIdentified/ScientificName/NameAtomised/Botanical/FirstEpithet (for botanical names),simple
http://rs.tdwg.org/dwc/terms/version/infraspecificEpithet-2023-06-28,infraspecificEpithet,Infraspecific Epithet,"The name of the lowest or terminal infraspecific epithet of the dwc:scientificName, excluding any rank designation.","In botany, name strings in literature and identifications may have multiple infraspecific ranks. According to the International Code of Nomenclature for algae, fungi, and plants (Schenzhen Code Articles 6.7 & Art. 24.1), valid names only have two epithets, with the lowest rank being the dwc:infraspecificEpithet. For example: the dwc:infraspecificEpithet in the string `Indigofera charlieriana subsp. sessilis var. scaberrima` is `scaberrima` and the dwc:scientificName is `Indigofera charlieriana var. scaberrima (Schinz) J.B.Gillett`. Use dwc:verbatimIdentification for the full name string used in a dwc:Identification.","`concolor` (for scientificName `Puma concolor concolor (Linnaeus, 1771)`); `oxyadenia` (for scientificName `Quercus agrifolia var. oxyadenia (Torr.) J.T. Howell`); `laxa` (for scientificName `Cheilanthes hirta f. laxa (Kunze) W.Jacobsen & N.Jacobsen`); `scaberrima` (for scientificName `Indigofera charlieriana var. scaberrima (Schinz) J.B.Gillett`)",http://rs.tdwg.org/dwc/terms/Taxon,6/28/2023,recommended,http://rs.tdwg.org/dwc/terms/version/infraspecificEpithet-2021-07-15,http://www.w3.org/1999/02/22-rdf-syntax-ns#Property,http://rs.tdwg.org/dwc/terms/infraspecificEpithet,DataSets/DataSet/Units/Unit/Identifications/Identification/TaxonIdentified/ScientificName/NameAtomised/Bacterial/SubspeciesEpithet or DataSets/DataSet/Units/Unit/Identifications/Identification/TaxonIdentified/ScientificName/NameAtomised/Botanical/SecondEpithet or DataSets/DataSet/Units/Unit/Identifications/Identification/TaxonIdentified/ScientificName/NameAtomised/Zoological/SubspeciesEpithet,simple
http://rs.tdwg.org/dwc/dwcore/version/InfraspecificRank-2007-04-17,InfraspecificRank,Infraspecific Rank,"The infraspecific rank (subspecies, variety, forma) of the InfraspecificEpithet. Examples: ""subsp."", ""var."", ""forma"".",,,,4/17/2007,deprecated,,http://www.w3.org/1999/02/22-rdf-syntax-ns#Property,http://rs.tdwg.org/dwc/dwcore/InfraspecificRank,DataSets/DataSet/Units/Unit/Identifications/Identification/TaxonIdentified/ScientificName/NameAtomised/Botanical/Rank,
http://rs.tdwg.org/dwc/terms/version/institutionCode-2017-10-06,institutionCode,Institution Code,The name (or acronym) in use by the institution having custody of the object(s) or information referred to in the record.,,"`MVZ`, `FMNH`, `CLO`, `UCMP`",,10/6/2017,superseded,http://rs.tdwg.org/dwc/terms/version/institutionCode-2009-09-11,http://www.w3.org/1999/02/22-rdf-syntax-ns#Property,http://rs.tdwg.org/dwc/terms/institutionCode,DataSets/DataSet/Units/Unit/SourceInstitutionID,simple
http://rs.tdwg.org/dwc/terms/version/institutionID-2017-10-06,institutionID,Institution ID,An identifier for the institution having custody of the object(s) or information referred to in the record.,"For physical specimens, the recommended best practice is to use an identifier from a collections registry such as the Global Registry of Biodiversity Repositories (http://grbio.org/).","`http://biocol.org/urn:lsid:biocol.org:col:34777`, `http://grbio.org/cool/km06-gtbn`",,10/6/2017,superseded,http://rs.tdwg.org/dwc/terms/version/institutionID-2009-09-11,http://www.w3.org/1999/02/22-rdf-syntax-ns#Property,http://rs.tdwg.org/dwc/terms/institutionID,DataSets/DataSet/Units/Unit/SourceInstitutionID,simple
http://rs.tdwg.org/dwc/terms/version/island-2023-06-28,island,Island,The name of the island on or near which the dcterms:Location occurs.,Recommended best practice is to use a controlled vocabulary such as the Getty Thesaurus of Geographic Names.,`Nosy Be`; `Bikini Atoll`; `Vancouver`; `Viti Levu`; `Zanzibar`,http://purl.org/dc/terms/Location,6/28/2023,recommended,http://rs.tdwg.org/dwc/terms/version/island-2017-10-06,http://www.w3.org/1999/02/22-rdf-syntax-ns#Property,http://rs.tdwg.org/dwc/terms/island,DataSets/DataSet/Units/Unit/Gathering/NamedAreas/NamedArea/AreaName with NamedAreas/NamedArea/AreaClass= Island,simple
http://rs.tdwg.org/dwc/terms/version/islandGroup-2023-06-28,islandGroup,Island Group,The name of the island group in which the dcterms:Location occurs.,Recommended best practice is to use a controlled vocabulary such as the Getty Thesaurus of Geographic Names.,`Alexander Archipelago`; `Archipiélago Diego Ramírez`; `Seychelles`,http://purl.org/dc/terms/Location,6/28/2023,recommended,http://rs.tdwg.org/dwc/terms/version/islandGroup-2017-10-06,http://www.w3.org/1999/02/22-rdf-syntax-ns#Property,http://rs.tdwg.org/dwc/terms/islandGroup,DataSets/DataSet/Units/Unit/Gathering/NamedAreas/NamedArea/AreaName with NamedAreas/NamedArea/AreaClass= Island group,simple
http://digir.net/schema/conceptual/darwin/2003/1.0/version/JulianDay-2003-06-17,JulianDay,Julian Day,"The ordinal day of the year (i.e., the number of days since December 31 of the previous year; January 1 is Julian Day 1) on which the cataloged item was collected. May be derived from the YearCollected, MonthCollected, and DayCollected by the provider.",,,,6/17/2003,deprecated,http://digir.net/schema/conceptual/darwin/2003/1.0/version/JulianDay-2003-06-13,http://www.w3.org/1999/02/22-rdf-syntax-ns#Property,http://digir.net/schema/conceptual/darwin/2003/1.0/JulianDay,,
http://rs.tdwg.org/dwc/terms/version/kingdom-2023-06-28,kingdom,Kingdom,The full scientific name of the kingdom in which the dwc:Taxon is classified.,,`Animalia`; `Archaea`; `Bacteria`; `Chromista`; `Fungi`; `Plantae`; `Protozoa`; `Viruses`,http://rs.tdwg.org/dwc/terms/Taxon,6/28/2023,recommended,http://rs.tdwg.org/dwc/terms/version/kingdom-2017-10-06,http://www.w3.org/1999/02/22-rdf-syntax-ns#Property,http://rs.tdwg.org/dwc/terms/kingdom,DataSets/DataSet/Units/Unit/Identifications/Identification/TaxonIdentified/HigherTaxa/HigherTaxon/HigherTaxonName with HigherTaxa/HigherTaxon/HigherTaxonRank = regnum,simple
http://dublincore.org/usage/terms/history/#languageT-001,language,Language,A language of the resource.,Recommended best practice is to use an IRI from the Library of Congress ISO 639-2 scheme http://id.loc.gov/vocabulary/iso639-2,,http://purl.org/dc/terms/,1/14/2008,recommended,,http://www.w3.org/1999/02/22-rdf-syntax-ns#Property,http://purl.org/dc/terms/language,not in ABCD,
http://rs.tdwg.org/dwc/terms/version/latestAgeOrHighestStage-2023-09-13,latestAgeOrHighestStage,Latest Age Or Highest Stage,The full name of the latest possible geochronologic age or highest chronostratigraphic stage attributable to the stratigraphic horizon from which the dwc:MaterialEntity was collected.,,`Atlantic`; `Boreal`; `Skullrockian`,http://rs.tdwg.org/dwc/terms/GeologicalContext,9/13/2023,recommended,http://rs.tdwg.org/dwc/terms/version/latestAgeOrHighestStage-2023-06-28,http://www.w3.org/1999/02/22-rdf-syntax-ns#Property,http://rs.tdwg.org/dwc/terms/latestAgeOrHighestStage,not in ABCD,simple
http://rs.tdwg.org/dwc/terms/version/LatestDateCollected-2008-11-19,LatestDateCollected,Latest Date Collected,"The latest date-time in a period during which a event occurred. If the event is recorded as occurring at a single date-time, populate both EarliestDateCollected and LatestDateCollected with the same value. Recommended best practice is to use an encoding scheme, such as ISO 8601:2004(E).","Date may be used to express temporal information at any level of granularity. Recommended best practice is to use an encoding scheme, such as the W3CDTF profile of ISO 8601 [W3CDTF].",,http://rs.tdwg.org/dwc/terms/Event,11/19/2008,deprecated,http://rs.tdwg.org/dwc/dwcore/version/LatestDateCollected-2007-04-17,http://www.w3.org/1999/02/22-rdf-syntax-ns#Property,http://rs.tdwg.org/dwc/terms/LatestDateCollected,DataSets/DataSet/Units/Unit/Gathering/ISODateTimeEnd,
http://rs.tdwg.org/dwc/terms/version/latestEonOrHighestEonothem-2023-09-13,latestEonOrHighestEonothem,Llatest Eon Or Highest Eonothem,"The full name of the latest possible geochronologic eon or highest chrono-stratigraphic eonothem or the informal name (""Precambrian"") attributable to the stratigraphic horizon from which the dwc:MaterialEntity was collected.",,`Phanerozoic`; `Proterozoic`,http://rs.tdwg.org/dwc/terms/GeologicalContext,9/13/2023,recommended,http://rs.tdwg.org/dwc/terms/version/latestEonOrHighestEonothem-2023-06-28,http://www.w3.org/1999/02/22-rdf-syntax-ns#Property,http://rs.tdwg.org/dwc/terms/latestEonOrHighestEonothem,not in ABCD,simple
http://rs.tdwg.org/dwc/terms/version/latestEpochOrHighestSeries-2023-09-13,latestEpochOrHighestSeries,Latest Epoch Or Highest Series,The full name of the latest possible geochronologic epoch or highest chronostratigraphic series attributable to the stratigraphic horizon from which the dwc:MaterialEntity was collected.,,`Holocene`; `Pleistocene`; `Ibexian Series`,http://rs.tdwg.org/dwc/terms/GeologicalContext,9/13/2023,recommended,http://rs.tdwg.org/dwc/terms/version/latestEpochOrHighestSeries-2023-06-28,http://www.w3.org/1999/02/22-rdf-syntax-ns#Property,http://rs.tdwg.org/dwc/terms/latestEpochOrHighestSeries,not in ABCD,simple
http://rs.tdwg.org/dwc/terms/version/latestEraOrHighestErathem-2023-09-13,latestEraOrHighestErathem,Latest Era Or Highest Erathem,The full name of the latest possible geochronologic era or highest chronostratigraphic erathem attributable to the stratigraphic horizon from which the dwc:MaterialEntity was collected.,,`Cenozoic`; `Mesozoic`,http://rs.tdwg.org/dwc/terms/GeologicalContext,9/13/2023,recommended,http://rs.tdwg.org/dwc/terms/version/latestEraOrHighestErathem-2023-06-28,http://www.w3.org/1999/02/22-rdf-syntax-ns#Property,http://rs.tdwg.org/dwc/terms/latestEraOrHighestErathem,not in ABCD,simple
http://rs.tdwg.org/dwc/iri/version/latestGeochronologicalEra-2023-09-13,latestGeochronologicalEra,Latest Geochronological Era,Use to link a dwc:GeologicalContext instance to chronostratigraphic time periods at the lowest possible level in a standardized hierarchy. Use this property to point to the latest possible geological time period from which the dwc:MaterialEntity was collected.,"Recommended best practice is to use an IRI from a controlled vocabulary. A ""convenience property"" that replaces Darwin Core literal-value terms related to geological context. See Section 2.7.6 of the Darwin Core RDF Guide for details.",,http://rs.tdwg.org/dwc/terms/attributes/UseWithIRI,9/13/2023,recommended,http://rs.tdwg.org/dwc/iri/version/latestGeochronologicalEra-2015-03-27,http://www.w3.org/1999/02/22-rdf-syntax-ns#Property,http://rs.tdwg.org/dwc/iri/latestGeochronologicalEra,not in ABCD,
http://rs.tdwg.org/dwc/terms/version/latestPeriodOrHighestSystem-2023-09-13,latestPeriodOrHighestSystem,Latest Period Or Highest System,The full name of the latest possible geochronologic period or highest chronostratigraphic system attributable to the stratigraphic horizon from which the dwc:MaterialEntity was collected.,,`Neogene`; `Tertiary`; `Quaternary`,http://rs.tdwg.org/dwc/terms/GeologicalContext,9/13/2023,recommended,http://rs.tdwg.org/dwc/terms/version/latestPeriodOrHighestSystem-2023-06-28,http://www.w3.org/1999/02/22-rdf-syntax-ns#Property,http://rs.tdwg.org/dwc/terms/latestPeriodOrHighestSystem,not in ABCD,simple
http://digir.net/schema/conceptual/darwin/2003/1.0/version/Latitude-2003-06-13,Latitude,Latitude,The latitude of the location from which the specimen was collected. This value should be expressed in decimal degrees with a datum such as WGS-84,,,,6/13/2003,deprecated,,http://www.w3.org/1999/02/22-rdf-syntax-ns#Property,http://digir.net/schema/conceptual/darwin/2003/1.0/Latitude,,
http://digir.net/schema/conceptual/darwin/2003/1.0/version/LatLongComments-2003-06-17,LatLongComments,Lat Long Comments,Comments about the LatLong determination.,,,,6/17/2003,deprecated,,http://www.w3.org/1999/02/22-rdf-syntax-ns#Property,http://digir.net/schema/conceptual/darwin/2003/1.0/LatLongComments,,
http://rs.tdwg.org/dwc/terms/version/lifeStage-2021-07-15,lifeStage,Life Stage,The age class or life stage of the Organism(s) at the time the Occurrence was recorded.,Recommended best practice is to use a controlled vocabulary.,"`zygote`, `larva`, `juvenile`, `adult`, `seedling`, `flowering`, `fruiting`",http://rs.tdwg.org/dwc/terms/Occurrence,7/15/2021,superseded,http://rs.tdwg.org/dwc/terms/version/lifeStage-2017-10-06,http://www.w3.org/1999/02/22-rdf-syntax-ns#Property,http://rs.tdwg.org/dwc/terms/lifeStage,DataSets/DataSet/Units/Unit/MycologicalUnit/MycologicalSexualStage or DataSets/DataSet/Units/Unit/MycologicalUnit/MycologicalLiveStages/MycologicalLiveStage or DataSets/DataSet/Units/Unit/ZoologicalUnit/PhasesOrStages/PhaseOrStage,simple
http://rs.tdwg.org/dwc/terms/version/lithostratigraphicTerms-2023-09-13,lithostratigraphicTerms,Lithostratigraphic Terms,The combination of all litho-stratigraphic names for the rock from which the dwc:MaterialEntity was collected.,,`Pleistocene-Weichselien`,http://rs.tdwg.org/dwc/terms/GeologicalContext,9/13/2023,recommended,http://rs.tdwg.org/dwc/terms/version/lithostratigraphicTerms-2017-10-06,http://www.w3.org/1999/02/22-rdf-syntax-ns#Property,http://rs.tdwg.org/dwc/terms/lithostratigraphicTerms,DataSets/DataSet/Units/Unit/Gathering/Stratigraphy/LithostratigraphicTerms,simple
http://rs.tdwg.org/dwc/terms/version/LivingSpecimen-2023-09-18,LivingSpecimen,Living Specimen,A specimen that is alive.,,`a living plant in a botanical garden`; `a living animal in a zoo`,,9/18/2023,recommended,http://rs.tdwg.org/dwc/terms/version/LivingSpecimen-2018-09-06,http://www.w3.org/2000/01/rdf-schema#Class,http://rs.tdwg.org/dwc/terms/LivingSpecimen,RecordBasisEnum/LivingSpecimen,simple
http://rs.tdwg.org/dwc/terms/version/locality-2023-06-28,locality,Locality,The specific description of the place.,"Less specific geographic information can be provided in other geographic terms (dwc:higherGeography, dwc:continent, dwc:country, dwc:stateProvince, dwc:county, dwc:municipality, dwc:waterBody, dwc:island, dwc:islandGroup). This term may contain information modified from the original to correct perceived errors or standardize the description.","`Bariloche, 25 km NNE via Ruta Nacional 40 (=Ruta 237)`; `Queets Rainforest, Olympic National Park`",http://purl.org/dc/terms/Location,6/28/2023,recommended,http://rs.tdwg.org/dwc/terms/version/locality-2021-07-15,http://www.w3.org/1999/02/22-rdf-syntax-ns#Property,http://rs.tdwg.org/dwc/terms/locality,DataSets/DataSet/Units/Unit/Gathering/NamedAreas/NamedArea/AreaName,simple
http://rs.tdwg.org/dwc/dwctype/version/Location-2009-04-24,Location,Location,A resource describing an instance of the Location class.,,,,4/24/2009,deprecated,,http://www.w3.org/2000/01/rdf-schema#Class,http://rs.tdwg.org/dwc/dwctype/Location,not in ABCD,
http://rs.tdwg.org/dwc/terms/version/locationAccordingTo-2023-06-28,locationAccordingTo,Location According To,"Information about the source of this dcterms:Location information. Could be a publication (gazetteer), institution, or team of individuals.","This term has an equivalent in the dwciri: namespace that allows only an IRI as a value, whereas this term allows for any string literal value.",`Getty Thesaurus of Geographic Names`; `GADM`,http://purl.org/dc/terms/Location,6/28/2023,recommended,http://rs.tdwg.org/dwc/terms/version/locationAccordingTo-2017-10-06,http://www.w3.org/1999/02/22-rdf-syntax-ns#Property,http://rs.tdwg.org/dwc/terms/locationAccordingTo,not in ABCD,simple
http://rs.tdwg.org/dwc/terms/version/locationAttributes-2009-04-24,locationAttributes,Location Attributes,"A list (concatenated and separated) of additional measurements, facts, characteristics, or assertions about the location.","Example: ""aspectheading=277; slopeindegrees=6""",,http://purl.org/dc/terms/Location,4/24/2009,deprecated,,http://www.w3.org/1999/02/22-rdf-syntax-ns#Property,http://rs.tdwg.org/dwc/terms/locationAttributes,not in ABCD,
http://rs.tdwg.org/dwc/terms/version/locationID-2023-06-28,locationID,Location ID,An identifier for the set of dcterms:Location information. May be a global unique identifier or an identifier specific to the data set.,,`https://opencontext.org/subjects/768A875F-E205-4D0B-DE55-BAB7598D0FD1`,http://purl.org/dc/terms/Location,6/28/2023,recommended,http://rs.tdwg.org/dwc/terms/version/locationID-2017-10-06,http://www.w3.org/1999/02/22-rdf-syntax-ns#Property,http://rs.tdwg.org/dwc/terms/locationID,not in ABCD,simple
http://rs.tdwg.org/dwc/terms/version/locationRemarks-2023-06-28,locationRemarks,Location Remarks,Comments or notes about the dcterms:Location.,,`under water since 2005`,http://purl.org/dc/terms/Location,6/28/2023,recommended,http://rs.tdwg.org/dwc/terms/version/locationRemarks-2017-10-06,http://www.w3.org/1999/02/22-rdf-syntax-ns#Property,http://rs.tdwg.org/dwc/terms/locationRemarks,DataSets/DataSet/Units/Unit/Gathering/AreaDetail,simple
http://digir.net/schema/conceptual/darwin/2003/1.0/version/Longitude-2003-06-13,Longitude,Longitude,The longitude of the location from which the specimen was collected. This value should be expressed in decimal degrees with a datum such as WGS-84,,,,6/13/2003,deprecated,,http://www.w3.org/1999/02/22-rdf-syntax-ns#Property,http://digir.net/schema/conceptual/darwin/2003/1.0/Longitude,,
http://rs.tdwg.org/dwc/terms/version/lowestBiostratigraphicZone-2023-09-13,lowestBiostratigraphicZone,Lowest Biostratigraphic Zone,The full name of the lowest possible geological biostratigraphic zone of the stratigraphic horizon from which the dwc:MaterialEntity was collected.,,`Maastrichtian`,http://rs.tdwg.org/dwc/terms/GeologicalContext,9/13/2023,recommended,http://rs.tdwg.org/dwc/terms/version/lowestBiostratigraphicZone-2017-10-06,http://www.w3.org/1999/02/22-rdf-syntax-ns#Property,http://rs.tdwg.org/dwc/terms/lowestBiostratigraphicZone,not in ABCD,simple
http://rs.tdwg.org/dwc/terms/version/MachineObservation-2023-09-18,MachineObservation,Machine Observation,An output of a machine observation process.,,`a photograph`; `a video`; `an audio recording`; `a remote sensing image`; `a dwc:Occurrence record based on telemetry`,,9/18/2023,recommended,http://rs.tdwg.org/dwc/terms/version/MachineObservation-2018-09-06,http://www.w3.org/2000/01/rdf-schema#Class,http://rs.tdwg.org/dwc/terms/MachineObservation,RecordBasisEnum/MachineObservation,simple
http://rs.tdwg.org/dwc/terms/version/MaterialCitation-2023-09-18,MaterialCitation,Material Citation,"A reference to or citation of one, a part of, or multiple specimens in scholarly publications.","This class constitutes a new value for the controlled vocabulary in the recommendations for basisOfRecord. When importing Darwin Core Archives of literature-based datasets to GBIF, the basisOfRecord should be changed from ""Occurrence"", ""PreservedSpecimen"" or ""Literature"" to ""MaterialCitation"".","`a citation of a physical specimen from a scientific collection in a taxonomic treatment in a scientific publication`; `a citation of a group of physical specimens, such as paratypes in a taxonomic treatment in a scientific publication`",,9/18/2023,recommended,http://rs.tdwg.org/dwc/terms/version/MaterialCitation-2021-07-15,http://www.w3.org/2000/01/rdf-schema#Class,http://rs.tdwg.org/dwc/terms/MaterialCitation,not in ABCD,simple
http://rs.tdwg.org/dwc/terms/version/MaterialEntity-2023-09-13,MaterialEntity,Material Entity,"An entity that can be identified, exists for some period of time, and consists in whole or in part of physical matter while it exists.","The term is defined at the most general level to admit descriptions of any subtype of material entity within the scope of Darwin Core. In particular, any kind of material sample, preserved specimen, fossil, or exemplar from living collections is intended to be subsumed under this term.",`an instance of a fossil`; `an instance of a herbarium sheet with its attached plant specimen`; `a particular part of the plant-derived material affixed to a herbarium sheet`; `an instance of a frozen tissue sample`; `a specific water sample`; `an instance of a meteorite fragment`; `a particular wolf in a zoo`; `a particular pack of wolves in the wild`; `an isolated molecule of DNA`; `a specific deep-frozen DNA sample`; `a particular field notebook`; `a particular paper page from a field notebook`; `an instance of a printed photograph`,,9/13/2023,recommended,,http://www.w3.org/2000/01/rdf-schema#Class,http://rs.tdwg.org/dwc/terms/MaterialEntity,"None (Specimen Unit, when used to denote a class of things, appears to be a broadly construed subclass.)",simple
