iri,term_localName,label,definition,comments,examples,organized_in,issued,status,replaces,rdf_type,term_iri,abcd_equivalence,flags
http://rs.tdwg.org/dwc/terms/version/EventAttributeDeterminedBy-2009-01-23,EventAttributeDeterminedBy,Event Attribute Determined By,The agent responsible for having determined the value of the measurement or characteristic of the sampling event.,"Example: ""Robert Hijmans""",,http://rs.tdwg.org/dwc/terms/EventAttribute,1/23/2009,deprecated,,http://www.w3.org/1999/02/22-rdf-syntax-ns#Property,http://rs.tdwg.org/dwc/terms/EventAttributeDeterminedBy,DataSets/DataSet/Units/Unit/Gathering/Altitude/MeasurementOrFactAtomised/MeasuredBy or DataSets/DataSet/Units/Unit/Gathering/Depth/MeasurementOrFactAtomised/MeasuredBy or DataSets/DataSet/Units/Unit/Gathering/Height/MeasurementOrFactAtomised/MeasuredBy or DataSets/DataSet/Units/Unit/Gathering/SiteMeasurementsOrFacts/SiteMeasurementOrFact/MeasurementOrFactAtomised/MeasuredBy or DataSets/DataSet/Units/Unit/Gathering/Biotope/MeasurementsOrFacts/MeasurementOrFactAtomised/MeasuredBy,
http://rs.tdwg.org/dwc/terms/version/EventAttributeDeterminedDate-2009-01-23,EventAttributeDeterminedDate,Event Attribute Determined Date,The date on which the the measurement or characteristic of the sampling event was made.,"Date may be used to express temporal information at any level of granularity. Recommended best practice is to use an encoding scheme, such as the W3CDTF profile of ISO 8601 [W3CDTF].",,http://rs.tdwg.org/dwc/terms/EventAttribute,1/23/2009,deprecated,,http://www.w3.org/1999/02/22-rdf-syntax-ns#Property,http://rs.tdwg.org/dwc/terms/EventAttributeDeterminedDate,DataSets/DataSet/Units/Unit/Gathering/Altitude/MeasurementOrFactAtomised/MeasurementDateTime or DataSets/DataSet/Units/Unit/Gathering/Depth/MeasurementOrFactAtomised/MeasurementDateTime or DataSets/DataSet/Units/Unit/Gathering/Height/MeasurementOrFactAtomised/MeasurementDateTime or DataSets/DataSet/Units/Unit/Gathering/SiteMeasurementsOrFacts/SiteMeasurementOrFact/MeasurementOrFactAtomised/MeasurementDateTime or DataSets/DataSet/Units/Unit/Gathering/Biotope/MeasurementsOrFacts/MeasurementOrFactAtomised/MeasurementDateTime,
http://rs.tdwg.org/dwc/terms/version/EventAttributeID-2008-11-19,EventAttributeID,Event Attribute ID,An identifier for the event attribute. May be a global unique identifier or an identifier specific to the data set.,,,http://rs.tdwg.org/dwc/terms/EventAttribute,11/19/2008,deprecated,,http://www.w3.org/1999/02/22-rdf-syntax-ns#Property,http://rs.tdwg.org/dwc/terms/EventAttributeID,not in ABCD,
http://rs.tdwg.org/dwc/terms/version/EventAttributeRemarks-2008-11-19,EventAttributeRemarks,Event Attribute Remarks,Comments or notes accompanying the measurement or characteristic of the sampling event.,"Example: ""temperature taken at 15:00""",,http://rs.tdwg.org/dwc/terms/EventAttribute,11/19/2008,deprecated,,http://www.w3.org/1999/02/22-rdf-syntax-ns#Property,http://rs.tdwg.org/dwc/terms/EventAttributeRemarks,not in ABCD,
http://rs.tdwg.org/dwc/terms/version/eventAttributes-2009-04-24,eventAttributes,Event Attributes,A list (concatenated and separated) of additional measurements or characteristics of the Event.,"Example: ""Relative humidity: 28 %; Temperature: 22 C; Sample size: 10 kg""",,http://rs.tdwg.org/dwc/terms/Event,4/24/2009,deprecated,,http://www.w3.org/1999/02/22-rdf-syntax-ns#Property,http://rs.tdwg.org/dwc/terms/eventAttributes,DataSets/DataSet/Units/Unit/Gathering/SiteMeasurementsOrFacts,
http://rs.tdwg.org/dwc/terms/version/EventAttributeType-2008-11-19,EventAttributeType,Event Attribute Type,The nature of the measurement or characteristic of the sampling event. Recommended best practice is to use a controlled vocabulary.,"Example: ""Temperature""",,http://rs.tdwg.org/dwc/terms/EventAttribute,11/19/2008,deprecated,,http://www.w3.org/1999/02/22-rdf-syntax-ns#Property,http://rs.tdwg.org/dwc/terms/EventAttributeType,DataSets/DataSet/Units/Unit/Gathering/SiteMeasurementsOrFacts/MeasurementOrFact/MeasurementOrFactAtomised/Parameter,
http://rs.tdwg.org/dwc/terms/version/EventAttributeUnit-2008-11-19,EventAttributeUnit,Event Attribute Unit,The units for the value of the measurement or characteristic of the sampling event. Recommended best practice is to use International System of Units (SI) units.,"Example: ""C""",,http://rs.tdwg.org/dwc/terms/EventAttribute,11/19/2008,deprecated,,http://www.w3.org/1999/02/22-rdf-syntax-ns#Property,http://rs.tdwg.org/dwc/terms/EventAttributeUnit,DataSets/DataSet/Units/Unit/Gathering/SiteMeasurementsOrFacts/MeasurementOrFact/MeasurementOrFactAtomised/UnitOfMeasurement,
http://rs.tdwg.org/dwc/terms/version/EventAttributeValue-2008-11-19,EventAttributeValue,Event Attribute,The value of the measurement or characteristic of the sampling event.,"Example: ""22""",,http://rs.tdwg.org/dwc/terms/EventAttribute,11/19/2008,deprecated,,http://www.w3.org/1999/02/22-rdf-syntax-ns#Property,http://rs.tdwg.org/dwc/terms/EventAttributeValue,DataSets/DataSet/Units/Unit/Gathering/SiteMeasurementsOrFacts/SiteMeasurementOrFact/MeasurementOrFactAtomised/LowerValue or DataSets/DataSet/Units/Unit/Gathering/SiteMeasurementsOrFacts/SiteMeasurementOrFact/MeasurementOrFactAtomised/UpperValue or DataSets/DataSet/Units/Unit/Gathering/Altitude/MeasurementOrFactAtomised/LowerValue or DataSets/DataSet/Units/Unit/Gathering/Altitude/MeasurementOrFactAtomised/UpperValue or DataSets/DataSet/Units/Unit/Gathering/Depth/MeasurementOrFactAtomised/LowerValue or DataSets/DataSet/Units/Unit/Gathering/Depth/MeasurementOrFactAtomised/UpperValue or DataSets/DataSet/Units/Unit/Gathering/Biotope/MeasurementsOrFacts/MeasurementOrFactAtomised/LowerValue or DataSets/DataSet/Units/Unit/Gathering/Biotope/MeasurementsOrFacts/MeasurementOrFactAtomised/UpperValue or DataSets/DataSet/Units/Unit/Gathering/Height/MeasurementOrFactAtomised/LowerValue or DataSets/DataSet/Units/Unit/Gathering/Height/MeasurementOrFactAtomised/UpperValue,
http://rs.tdwg.org/dwc/terms/version/eventDate-2023-06-28,eventDate,Event Date,"The date-time or interval during which a dwc:Event occurred. For occurrences, this is the date-time when the dwc:Event was recorded. Not suitable for a time in a geological context.",Recommended best practice is to use a date that conforms to ISO 8601-1:2019.,`1963-03-08T14:07-0600` (8 Mar 1963 at 2:07pm in the time zone six hours earlier than UTC); `2009-02-20T08:40Z` (20 February 2009 8:40am UTC); `2018-08-29T15:19` (3:19pm local time on 29 August 2018); `1809-02-12` (some time during 12 February 1809); `1906-06` (some time in June 1906); `1971` (some time in the year 1971); `2007-03-01T13:00:00Z/2008-05-11T15:30:00Z` (some time during the interval between 1 March 2007 1pm UTC and 11 May 2008 3:30pm UTC); `1900/1909` (some time during the interval between the beginning of the year 1900 and the end of the year 1909); `2007-11-13/15` (some time in the interval between 13 November 2007 and 15 November 2007),http://rs.tdwg.org/dwc/terms/Event,6/28/2023,recommended,http://rs.tdwg.org/dwc/terms/version/eventDate-2020-08-12,http://www.w3.org/1999/02/22-rdf-syntax-ns#Property,http://rs.tdwg.org/dwc/terms/eventDate,accessible from DataSets/DataSet/Units/Unit/Gathering/ISODateTimeBegin and DataSets/DataSet/Units/Unit/Gathering/ISODateTimeEnd,simple
http://rs.tdwg.org/dwc/terms/version/eventID-2023-06-28,eventID,Event ID,An identifier for the set of information associated with a dwc:Event (something that occurs at a place and time). May be a global unique identifier or an identifier specific to the data set.,,`INBO:VIS:Ev:00009375`,http://rs.tdwg.org/dwc/terms/Event,6/28/2023,recommended,http://rs.tdwg.org/dwc/terms/version/eventID-2017-10-06,http://www.w3.org/1999/02/22-rdf-syntax-ns#Property,http://rs.tdwg.org/dwc/terms/eventID,DataSets/DataSet/Units/Unit/Gathering/Code,simple
http://rs.tdwg.org/dwc/terms/version/EventMeasurement-2008-11-19,EventMeasurement,Event Measurement,The category of information pertaining to measurements associated with an event.,,,http://rs.tdwg.org/dwc/terms/Event,11/19/2008,deprecated,,http://www.w3.org/2000/01/rdf-schema#Class,http://rs.tdwg.org/dwc/terms/EventMeasurement,DataSets/DataSet/Units/Unit/Gathering/SiteMeasurementsOrFacts,
http://rs.tdwg.org/dwc/terms/version/eventMeasurementAccuracy-2009-04-24,eventMeasurementAccuracy,Event Measurement Accuracy,The description of the error associated with the EventAttributeValue.,"Example: ""0.01"", ""normal distribution with variation of 2 m""",,http://rs.tdwg.org/dwc/terms/EventMeasurement,4/24/2009,deprecated,http://rs.tdwg.org/dwc/terms/version/EventAttributeAccuracy-2009-01-18,http://www.w3.org/1999/02/22-rdf-syntax-ns#Property,http://rs.tdwg.org/dwc/terms/eventMeasurementAccuracy,DataSet/Units/Unit/Gathering/SiteMeasurementsOrFacts/SiteMeasurementOrFact/MeasurementOrFactAtomised/Accuracy or DataSets/DataSet/Units/Unit/Gathering/Aspect/Accuracy or DataSets/DataSet/Units/Unit/Gathering/Altitude/MeasurementOrFactAtomised/Accuracy or DataSets/DataSet/Units/Unit/Gathering/Depth/MeasurementOrFactAtomised/Accuracy or DataSets/DataSet/Units/Unit/Gathering/Biotope/MeasurementsOrFacts/MeasurementOrFactAtomised/Accuracy or DataSets/DataSet/Units/Unit/MeasurementsOrFacts/MeasurementOrFact/MeasurementOrFactAtomised/Accuracy,
http://rs.tdwg.org/dwc/terms/version/eventMeasurementDeterminedBy-2009-04-24,eventMeasurementDeterminedBy,Event Measurement Determined By,The agent responsible for having determined the value of the measurement or characteristic of the event.,"Example: ""Robert Hijmans""",,http://rs.tdwg.org/dwc/terms/EventMeasurement,4/24/2009,deprecated,http://rs.tdwg.org/dwc/terms/version/EventAttributeDeterminedBy-2009-01-23,http://www.w3.org/1999/02/22-rdf-syntax-ns#Property,http://rs.tdwg.org/dwc/terms/eventMeasurementDeterminedBy,DataSets/DataSet/Units/Unit/Gathering/Altitude/MeasurementOrFactAtomised/MeasuredBy or DataSets/DataSet/Units/Unit/Gathering/Depth/MeasurementOrFactAtomised/MeasuredBy or DataSets/DataSet/Units/Unit/Gathering/Height/MeasurementOrFactAtomised/MeasuredBy or DataSets/DataSet/Units/Unit/Gathering/SiteMeasurementsOrFacts/SiteMeasurementOrFact/MeasurementOrFactAtomised/MeasuredBy or DataSets/DataSet/Units/Unit/Gathering/Biotope/MeasurementsOrFacts/MeasurementOrFactAtomised/MeasuredBy,
http://rs.tdwg.org/dwc/terms/version/eventMeasurementDeterminedDate-2009-04-24,eventMeasurementDeterminedDate,Event Measurement Determined Date,"The date on which the the measurement or characteristic of the event was made. Recommended best practice is to use an encoding scheme, such as ISO 8601:2004(E).","Examples: ""1963-03-08T14:07-0600"" is 8 Mar 1963 2:07pm in the time zone six hours earlier than UTC, ""2009-02-20T08:40Z"" is 20 Feb 2009 8:40am UTC, ""1809-02-12"" is 12 Feb 1809, ""1906-06"" is Jun 1906, ""1971"" is just that year, ""2007-03-01T13:00:00Z/2008-05-11T15:30:00Z"" is the interval between 1 Mar 2007 1pm UTC and 11 May 2008 3:30pm UTC, ""2007-11-13/15"" is the interval between 13 Nov 2007 and 15 Nov 2007.",,http://rs.tdwg.org/dwc/terms/EventMeasurement,4/24/2009,deprecated,http://rs.tdwg.org/dwc/terms/version/EventAttributeDeterminedDate-2009-01-23,http://www.w3.org/1999/02/22-rdf-syntax-ns#Property,http://rs.tdwg.org/dwc/terms/eventMeasurementDeterminedDate,DataSets/DataSet/Units/Unit/Gathering/Altitude/MeasurementOrFactAtomised/MeasurementDateTime or DataSets/DataSet/Units/Unit/Gathering/Depth/MeasurementOrFactAtomised/MeasurementDateTime or DataSets/DataSet/Units/Unit/Gathering/Height/MeasurementOrFactAtomised/MeasurementDateTime or DataSets/DataSet/Units/Unit/Gathering/SiteMeasurementsOrFacts/SiteMeasurementOrFact/MeasurementOrFactAtomised/MeasurementDateTime or DataSets/DataSet/Units/Unit/Gathering/Biotope/MeasurementsOrFacts/MeasurementOrFactAtomised/MeasurementDateTime,
http://rs.tdwg.org/dwc/terms/version/eventMeasurementID-2009-04-24,eventMeasurementID,Event Measurement ID,An identifier for the event attribute. May be a global unique identifier or an identifier specific to the data set.,,,http://rs.tdwg.org/dwc/terms/EventMeasurement,4/24/2009,deprecated,http://rs.tdwg.org/dwc/terms/version/EventAttributeID-2008-11-19,http://www.w3.org/1999/02/22-rdf-syntax-ns#Property,http://rs.tdwg.org/dwc/terms/eventMeasurementID,not in ABCD,
http://rs.tdwg.org/dwc/terms/version/eventMeasurementRemarks-2009-04-24,eventMeasurementRemarks,Event Measurement Remarks,Comments or notes accompanying the measurement or characteristic of the event.,"Example: ""temperature taken at 15:00""",,http://rs.tdwg.org/dwc/terms/EventMeasurement,4/24/2009,deprecated,,http://www.w3.org/1999/02/22-rdf-syntax-ns#Property,http://rs.tdwg.org/dwc/terms/eventMeasurementRemarks,not in ABCD,
http://rs.tdwg.org/dwc/terms/version/eventMeasurementType-2009-04-24,eventMeasurementType,Event Measurement Type,The nature of the measurement or characteristic of the event. Recommended best practice is to use a controlled vocabulary.,"Example: ""temperature""",,http://rs.tdwg.org/dwc/terms/EventMeasurement,4/24/2009,deprecated,http://rs.tdwg.org/dwc/terms/version/EventAttributeType-2008-11-19,http://www.w3.org/1999/02/22-rdf-syntax-ns#Property,http://rs.tdwg.org/dwc/terms/eventMeasurementType,DataSets/DataSet/Units/Unit/Gathering/SiteMeasurementsOrFacts/MeasurementOrFact/MeasurementOrFactAtomised/Parameter,
http://rs.tdwg.org/dwc/terms/version/eventMeasurementUnit-2009-04-24,eventMeasurementUnit,Event Measurement Unit,The units for the value of the measurement or characteristic of the event. Recommended best practice is to use International System of Units (SI) units.,"Example: ""C""",,http://rs.tdwg.org/dwc/terms/EventMeasurement,4/24/2009,deprecated,http://rs.tdwg.org/dwc/terms/version/EventAttributeUnit-2008-11-19,http://www.w3.org/1999/02/22-rdf-syntax-ns#Property,http://rs.tdwg.org/dwc/terms/eventMeasurementUnit,DataSets/DataSet/Units/Unit/Gathering/SiteMeasurementsOrFacts/MeasurementOrFact/MeasurementOrFactAtomised/UnitOfMeasurement,
http://rs.tdwg.org/dwc/terms/version/eventMeasurementValue-2009-04-24,eventMeasurementValue,Event Measurement Value,The value of the measurement or characteristic of the event.,"Example: ""22""",,http://rs.tdwg.org/dwc/terms/EventMeasurement,4/24/2009,deprecated,http://rs.tdwg.org/dwc/terms/version/EventAttributeValue-2008-11-19,http://www.w3.org/1999/02/22-rdf-syntax-ns#Property,http://rs.tdwg.org/dwc/terms/eventMeasurementValue,DataSets/DataSet/Units/Unit/Gathering/SiteMeasurementsOrFacts/SiteMeasurementOrFact/MeasurementOrFactAtomised/LowerValue or DataSets/DataSet/Units/Unit/Gathering/SiteMeasurementsOrFacts/SiteMeasurementOrFact/MeasurementOrFactAtomised/UpperValue or DataSets/DataSet/Units/Unit/Gathering/Altitude/MeasurementOrFactAtomised/LowerValue or DataSets/DataSet/Units/Unit/Gathering/Altitude/MeasurementOrFactAtomised/UpperValue or DataSets/DataSet/Units/Unit/Gathering/Depth/MeasurementOrFactAtomised/LowerValue or DataSets/DataSet/Units/Unit/Gathering/Depth/MeasurementOrFactAtomised/UpperValue or DataSets/DataSet/Units/Unit/Gathering/Biotope/MeasurementsOrFacts/MeasurementOrFactAtomised/LowerValue or DataSets/DataSet/Units/Unit/Gathering/Biotope/MeasurementsOrFacts/MeasurementOrFactAtomised/UpperValue or DataSets/DataSet/Units/Unit/Gathering/Height/MeasurementOrFactAtomised/LowerValue or DataSets/DataSet/Units/Unit/Gathering/Height/MeasurementOrFactAtomised/UpperValue,
http://rs.tdwg.org/dwc/terms/version/eventRemarks-2023-06-28,eventRemarks,Event Remarks,Comments or notes about the dwc:Event.,,`After the recent rains the river is nearly at flood stage.`,http://rs.tdwg.org/dwc/terms/Event,6/28/2023,recommended,http://rs.tdwg.org/dwc/terms/version/eventRemarks-2017-10-06,http://www.w3.org/1999/02/22-rdf-syntax-ns#Property,http://rs.tdwg.org/dwc/terms/eventRemarks,DataSets/DataSet/Units/Unit/Gathering/Notes,simple
http://rs.tdwg.org/dwc/terms/version/eventTime-2023-06-28,eventTime,Event Time,The time or interval during which a dwc:Event occurred.,Recommended best practice is to use a time of day that conforms to ISO 8601-1:2019.,`14:07-0600` (2:07pm in the time zone six hours earlier than UTC); `08:40:21Z` (8:40:21am UTC); `13:00:00Z/15:30:00Z` (the interval between 1pm UTC and 3:30pm UTC),http://rs.tdwg.org/dwc/terms/Event,6/28/2023,recommended,http://rs.tdwg.org/dwc/terms/version/eventTime-2020-08-12,http://www.w3.org/1999/02/22-rdf-syntax-ns#Property,http://rs.tdwg.org/dwc/terms/eventTime,accessible from DataSets/DataSet/Units/Unit/Gathering/ISODateTimeBegin and DataSets/DataSet/Units/Unit/Gathering/ISODateTimeEnd,simple
http://rs.tdwg.org/dwc/terms/version/eventType-2023-06-28,eventType,Event Type,The nature of the dwc:Event.,"Recommended best practice is to use a controlled vocabulary. Regardless of the dwc:eventType, the interval of the dwc:Event can be captured in dwc:eventDate. This term has an equivalent in the dwciri: namespace that allows only an IRI as a value, whereas this term allows for any string literal value.",`Sample`; `Observation`; `Site Visit`; `Biotic Interaction`; `Bioblitz`; `Expedition`; `Survey`; `Project`,http://rs.tdwg.org/dwc/terms/Event,6/28/2023,recommended,,http://www.w3.org/1999/02/22-rdf-syntax-ns#Property,http://rs.tdwg.org/dwc/terms/eventType,not in ABCD,simple
http://rs.tdwg.org/dwc/terms/version/family-2023-06-28,family,Family,The full scientific name of the family in which the dwc:Taxon is classified.,,`Felidae`; `Monocleaceae`,http://rs.tdwg.org/dwc/terms/Taxon,6/28/2023,recommended,http://rs.tdwg.org/dwc/terms/version/family-2017-10-06,http://www.w3.org/1999/02/22-rdf-syntax-ns#Property,http://rs.tdwg.org/dwc/terms/family,DataSets/DataSet/Units/Unit/Identifications/Identification/TaxonIdentified/HigherTaxa/HigherTaxon/HigherTaxonName with HigherTaxa/HigherTaxon/HigherTaxonRank = familia,simple
http://rs.tdwg.org/dwc/terms/version/fieldNotes-2023-06-28,fieldNotes,Field Notes,"One of a) an indicator of the existence of, b) a reference to (publication, URI), or c) the text of notes taken in the field about the dwc:Event.","This term has an equivalent in the dwciri: namespace that allows only an IRI as a value, whereas this term allows for any string literal value.",`Notes available in the Grinnell-Miller Library.`,http://rs.tdwg.org/dwc/terms/Event,6/28/2023,recommended,http://rs.tdwg.org/dwc/terms/version/fieldNotes-2017-10-06,http://www.w3.org/1999/02/22-rdf-syntax-ns#Property,http://rs.tdwg.org/dwc/terms/fieldNotes,DataSets/DataSet/Units/Unit/FieldNotes,simple
http://rs.tdwg.org/dwc/terms/version/fieldNumber-2023-06-28,fieldNumber,Field Number,An identifier given to the dwc:Event in the field. Often serves as a link between field notes and the dwc:Event.,"This term has an equivalent in the dwciri: namespace that allows only an IRI as a value, whereas this term allows for any string literal value.",`RV Sol 87-03-08`,http://rs.tdwg.org/dwc/terms/Event,6/28/2023,recommended,http://rs.tdwg.org/dwc/terms/version/fieldNumber-2017-10-06,http://www.w3.org/1999/02/22-rdf-syntax-ns#Property,http://rs.tdwg.org/dwc/terms/fieldNumber,DataSets/DataSet/Units/Unit/Gathering/Code,simple
http://rs.tdwg.org/dwc/terms/version/footprintSpatialFit-2023-06-28,footprintSpatialFit,Footprint Spatial Fit,"The ratio of the area of the dwc:footprintWKT to the area of the true (original, or most specific) spatial representation of the dcterms:Location. Legal values are 0, greater than or equal to 1, or undefined. A value of 1 is an exact match or 100% overlap. A value of 0 should be used if the given dwc:footprintWKT does not completely contain the original representation. The dwc:footprintSpatialFit is undefined (and should be left empty) if the original representation is any geometry without area (e.g., a point or polyline) and without uncertainty and the given georeference is not that same geometry (without uncertainty). If both the original and the given georeference are the same point, the dwc:footprintSpatialFit is 1.","Detailed explanations with graphical examples can be found in the Georeferencing Best Practices, Chapman and Wieczorek, 2020 (https://doi.org/10.15468/doc-gg7h-s853).",`0`; `1`; `1.5708`,http://purl.org/dc/terms/Location,6/28/2023,recommended,http://rs.tdwg.org/dwc/terms/version/footprintSpatialFit-2020-08-20,http://www.w3.org/1999/02/22-rdf-syntax-ns#Property,http://rs.tdwg.org/dwc/terms/footprintSpatialFit,DataSets/DataSet/Units/Unit/Gathering/FootprintSpatialFit,simple
http://rs.tdwg.org/dwc/terms/version/footprintSRS-2023-06-28,footprintSRS,Footprint SRS,"The ellipsoid, geodetic datum, or spatial reference system (SRS) upon which the geometry given in dwc:footprintWKT is based.","Recommended best practice is to use the EPSG code of the SRS, if known. Otherwise use a controlled vocabulary for the name or code of the geodetic datum, if known. Otherwise use a controlled vocabulary for the name or code of the ellipsoid, if known. If none of these is known, use the value `unknown`. It is also permitted to provide the SRS in Well-Known-Text, especially if no EPSG code provides the necessary values for the attributes of the SRS. Do not use this term to describe the SRS of the dwc:decimalLatitude and dwc:decimalLongitude, nor of any verbatim coordinates - use the dwc:geodeticDatum and dwc:verbatimSRS instead. This term has an equivalent in the dwciri: namespace that allows only an IRI as a value, whereas this term allows for any string literal value.","`epsg:4326`; `GEOGCS[""GCS_WGS_1984"", DATUM[""D_WGS_1984"", SPHEROID[""WGS_1984"",6378137,298.257223563]], PRIMEM[""Greenwich"",0], UNIT[""Degree"",0.0174532925199433]]` (WKT for the standard WGS84 Spatial Reference System EPSG:4326)",http://purl.org/dc/terms/Location,6/28/2023,recommended,http://rs.tdwg.org/dwc/terms/version/footprintSRS-2021-07-15,http://www.w3.org/1999/02/22-rdf-syntax-ns#Property,http://rs.tdwg.org/dwc/terms/footprintSRS,not in ABCD,simple
http://rs.tdwg.org/dwc/terms/version/footprintWKT-2023-06-28,footprintWKT,Footprint WKT,"A Well-Known Text (WKT) representation of the shape (footprint, geometry) that defines the dcterms:Location. A dcterms:Location may have both a point-radius representation (see dwc:decimalLatitude) and a footprint representation, and they may differ from each other.","This term has an equivalent in the dwciri: namespace that allows only an IRI as a value, whereas this term allows for any string literal value.","`POLYGON ((10 20, 11 20, 11 21, 10 21, 10 20))` (the one-degree bounding box with opposite corners at longitude=10, latitude=20 and longitude=11, latitude=21)",http://purl.org/dc/terms/Location,6/28/2023,recommended,http://rs.tdwg.org/dwc/terms/version/footprintWKT-2017-10-06,http://www.w3.org/1999/02/22-rdf-syntax-ns#Property,http://rs.tdwg.org/dwc/terms/footprintWKT,DataSets/DataSet/Units/Unit/Gathering/FootprintWKT (ABCD v2.06b),simple
http://rs.tdwg.org/dwc/terms/version/formation-2023-09-13,formation,Formation,The full name of the lithostratigraphic formation from which the dwc:MaterialEntity was collected.,,`Notch Peak Formation`; `House Limestone`; `Fillmore Formation`,http://rs.tdwg.org/dwc/terms/GeologicalContext,9/13/2023,recommended,http://rs.tdwg.org/dwc/terms/version/formation-2023-06-28,http://www.w3.org/1999/02/22-rdf-syntax-ns#Property,http://rs.tdwg.org/dwc/terms/formation,not in ABCD,simple
http://rs.tdwg.org/dwc/terms/version/FossilSpecimen-2023-09-18,FossilSpecimen,Fossil Specimen,A preserved specimen that is a fossil.,,`a body fossil`; `a coprolite`; `a gastrolith`; `an ichnofossil`; `a piece of a petrified tree`,,9/18/2023,recommended,http://rs.tdwg.org/dwc/terms/version/FossilSpecimen-2018-09-06,http://www.w3.org/2000/01/rdf-schema#Class,http://rs.tdwg.org/dwc/terms/FossilSpecimen,RecordBasisEnum/FossileSpecimen,simple
http://rs.tdwg.org/dwc/iri/version/fromLithostratigraphicUnit-2015-03-27,fromLithostratigraphicUnit,From Lithostratigraphic Unit,Use to link a dwc:GeologicalContext instance to an IRI-identified lithostratigraphic unit at the lowest possible level in a hierarchy.,"Recommended best practice is to use an IRI from a controlled vocabulary. A ""convenience property"" that replaces Darwin Core literal-value terms related to geological context. See Section 2.7.7 of the Darwin Core RDF Guide for details.",,http://rs.tdwg.org/dwc/terms/attributes/UseWithIRI,3/27/2015,recommended,,http://www.w3.org/1999/02/22-rdf-syntax-ns#Property,http://rs.tdwg.org/dwc/iri/fromLithostratigraphicUnit,not in ABCD,
http://digir.net/schema/conceptual/darwin/2003/1.0/version/GenBankNum-2003-06-17,GenBankNum,Gen Bank Num,GenBank Accession number.,,,,6/17/2003,deprecated,,http://www.w3.org/1999/02/22-rdf-syntax-ns#Property,http://digir.net/schema/conceptual/darwin/2003/1.0/GenBankNum,,
http://rs.tdwg.org/dwc/curatorial/version/GenBankNumber-2007-04-17,GenBankNumber,Gen Bank Number,GenBank Accession number(s) associated with the biological individual(s) referred to by the cataloged object.,,,,4/17/2007,deprecated,http://digir.net/schema/conceptual/darwin/2003/1.0/version/GenBankNum-2003-06-17,http://www.w3.org/1999/02/22-rdf-syntax-ns#Property,http://rs.tdwg.org/dwc/curatorial/GenBankNumber,DataSets/DataSet/Units/Unit/Sequences/Sequence/ID-in-Database + constant,
http://rs.tdwg.org/dwc/terms/version/Generalizations-2008-11-19,Generalizations,Generalizations,Actions taken to make the data as shared less specific or complete than in its original form. Suggests that alternative data of highly quality may be available on request.,"Examples: ""Coordinates generalized from original GPS coordinates to the nearest half degree grid cell"", ""locality information given only to nearest county"".",,,11/19/2008,deprecated,,http://www.w3.org/1999/02/22-rdf-syntax-ns#Property,http://rs.tdwg.org/dwc/terms/Generalizations,not in ABCD,
